{
  "schemaVersion": "retail-client-demo-surface-state-capture-manifest/v1",
  "originalHtml": {
    "path": "docs/ai_retail_intelligence_dashboard_multicurrency_v6.html",
    "sha256": "799d4bf355a8985689219acc3297253ae3542d9a61a1853b7add6cd3ad41d574"
  },
  "viewports": {
    "desktop": {"width": 1440, "height": 1100},
    "breakpoint": {"width": 1024, "height": 900},
    "mobile": {"width": 390, "height": 844}
  },
  "surfaces": [
    {"surfaceId":"page.data-management","pageId":"dataManagement","kind":"page","accessMode":"read_only","captureClass":"full_review","triggerSelector":"button[data-nav-label='Data Management']","testId":"app.data-management.page","captureId":"page.data-management","desktop":{"status":"pending","path":null,"sha256":null},"mobile":{"status":"pending","path":null,"sha256":null},"keyboardStatus":"pending"},
    {"surfaceId":"page.demand-forecast","pageId":"demandForecast","kind":"page","accessMode":"read_only","captureClass":"full_review","triggerSelector":"button[data-nav-label='Demand Forecast']","testId":"forecast.page","captureId":"page.demand-forecast","desktop":{"status":"pending","path":null,"sha256":null},"mobile":{"status":"pending","path":null,"sha256":null},"keyboardStatus":"pending"},
    {"surfaceId":"page.inventory-overview","pageId":"inventoryOverview","kind":"page","accessMode":"read_only","captureClass":"full_review","triggerSelector":"button[data-nav-label='Inventory Overview']","testId":"inventory.inventoryOverview.page","captureId":"page.inventory-overview","desktop":{"status":"pending","path":null,"sha256":null},"mobile":{"status":"pending","path":null,"sha256":null},"keyboardStatus":"pending"},
    {"surfaceId":"page.store-inventory","pageId":"storeInventory","kind":"page","accessMode":"read_only","captureClass":"full_review","triggerSelector":"button[data-nav-label='Store Inventory']","testId":"inventory.storeInventory.page","captureId":"page.store-inventory","desktop":{"status":"pending","path":null,"sha256":null},"mobile":{"status":"pending","path":null,"sha256":null},"keyboardStatus":"pending"},
    {"surfaceId":"page.warehouse-inventory","pageId":"warehouseInventory","kind":"page","accessMode":"read_only","captureClass":"full_review","triggerSelector":"button[data-nav-label='Warehouse Inventory']","testId":"inventory.warehouseInventory.page","captureId":"page.warehouse-inventory","desktop":{"status":"pending","path":null,"sha256":null},"mobile":{"status":"pending","path":null,"sha256":null},"keyboardStatus":"pending"},
    {"surfaceId":"page.inventory-ageing","pageId":"inventoryAgeing","kind":"page","accessMode":"read_only","captureClass":"full_review","triggerSelector":"button[data-nav-label='Inventory Ageing']","testId":"inventory.inventoryAgeing.page","captureId":"page.inventory-ageing","desktop":{"status":"pending","path":null,"sha256":null},"mobile":{"status":"pending","path":null,"sha256":null},"keyboardStatus":"pending"},
    {"surfaceId":"page.inventory-transfers","pageId":"inventoryTransfers","kind":"page","accessMode":"read_only","captureClass":"full_review","triggerSelector":"button[data-nav-label='Stock Transfers']","testId":"inventory.inventoryTransfers.page","captureId":"page.inventory-transfers","desktop":{"status":"pending","path":null,"sha256":null},"mobile":{"status":"pending","path":null,"sha256":null},"keyboardStatus":"pending"},
    {"surfaceId":"page.inventory-valuation","pageId":"inventoryValuation","kind":"page","accessMode":"read_only","captureClass":"full_review","triggerSelector":"button[data-nav-label='Inventory Valuation']","testId":"inventory.inventoryValuation.page","captureId":"page.inventory-valuation","desktop":{"status":"pending","path":null,"sha256":null},"mobile":{"status":"pending","path":null,"sha256":null},"keyboardStatus":"pending"},
    {"surfaceId":"page.expiry-waste","pageId":"expiryWaste","kind":"page","accessMode":"read_only","captureClass":"full_review","triggerSelector":"button[data-nav-label='Expiry & Waste']","testId":"inventory.expiryWaste.page","captureId":"page.expiry-waste","desktop":{"status":"pending","path":null,"sha256":null},"mobile":{"status":"pending","path":null,"sha256":null},"keyboardStatus":"pending"},
    {"surfaceId":"page.replenishment-planner","pageId":"replenishmentPlanner","kind":"page","accessMode":"read_only","captureClass":"full_review","triggerSelector":"button[data-nav-label='Replenishment Planner']","testId":"inventory.replenishmentPlanner.page","captureId":"page.replenishment-planner","desktop":{"status":"pending","path":null,"sha256":null},"mobile":{"status":"pending","path":null,"sha256":null},"keyboardStatus":"pending"},
    {"surfaceId":"page.suggested-orders","pageId":"suggestedOrders","kind":"page","accessMode":"read_only","captureClass":"full_review","triggerSelector":"button[data-nav-label='Suggested Orders']","testId":"inventory.suggestedOrders.page","captureId":"page.suggested-orders","desktop":{"status":"pending","path":null,"sha256":null},"mobile":{"status":"pending","path":null,"sha256":null},"keyboardStatus":"pending"},
    {"surfaceId":"page.supplier-planning","pageId":"supplierPlanning","kind":"page","accessMode":"read_only","captureClass":"full_review","triggerSelector":"button[data-nav-label='Supplier Planning']","testId":"inventory.supplierPlanning.page","captureId":"page.supplier-planning","desktop":{"status":"pending","path":null,"sha256":null},"mobile":{"status":"pending","path":null,"sha256":null},"keyboardStatus":"pending"},
    {"surfaceId":"page.safety-stock","pageId":"safetyStock","kind":"page","accessMode":"read_only","captureClass":"full_review","triggerSelector":"button[data-nav-label='Safety Stock']","testId":"inventory.safetyStock.page","captureId":"page.safety-stock","desktop":{"status":"pending","path":null,"sha256":null},"mobile":{"status":"pending","path":null,"sha256":null},"keyboardStatus":"pending"},
    {"surfaceId":"page.allocation-fulfillment","pageId":"allocationFulfillment","kind":"page","accessMode":"read_only","captureClass":"full_review","triggerSelector":"button[data-nav-label='Allocation & Fulfillment']","testId":"inventory.allocationFulfillment.page","captureId":"page.allocation-fulfillment","desktop":{"status":"pending","path":null,"sha256":null},"mobile":{"status":"pending","path":null,"sha256":null},"keyboardStatus":"pending"},
    {"surfaceId":"page.replenishment-exceptions","pageId":"replenishmentExceptions","kind":"page","accessMode":"read_only","captureClass":"full_review","triggerSelector":"button[data-nav-label='Exceptions']","testId":"inventory.replenishmentExceptions.page","captureId":"page.replenishment-exceptions","desktop":{"status":"pending","path":null,"sha256":null},"mobile":{"status":"pending","path":null,"sha256":null},"keyboardStatus":"pending"},
    {"surfaceId":"page.stock-health","pageId":"stockHealth","kind":"page","accessMode":"read_only","captureClass":"full_review","triggerSelector":"button[data-nav-label='Stock Health']","testId":"inventory.stockHealth.page","captureId":"page.stock-health","desktop":{"status":"pending","path":null,"sha256":null},"mobile":{"status":"pending","path":null,"sha256":null},"keyboardStatus":"pending"},
    {"surfaceId":"page.price-recommendations","pageId":"priceRecommendations","kind":"page","accessMode":"business_live","captureClass":"full_review","triggerSelector":"button[data-nav-label='Price Recommendations']","testId":"pricing.recommendations.page","captureId":"page.price-recommendations","desktop":{"status":"pending","path":null,"sha256":null},"mobile":{"status":"pending","path":null,"sha256":null},"keyboardStatus":"pending"},
    {"surfaceId":"page.price-simulation","pageId":"priceSimulation","kind":"page","accessMode":"business_live","captureClass":"full_review","triggerSelector":"button[data-nav-label='Price Simulation']","testId":"pricing.simulation.page","captureId":"page.price-simulation","desktop":{"status":"pending","path":null,"sha256":null},"mobile":{"status":"pending","path":null,"sha256":null},"keyboardStatus":"pending"},
    {"surfaceId":"page.competitor-monitor","pageId":"competitorMonitor","kind":"page","accessMode":"read_only","captureClass":"full_review","triggerSelector":"button[data-nav-label='Competitor Monitor']","testId":"pricing.competitor.page","captureId":"page.competitor-monitor","desktop":{"status":"pending","path":null,"sha256":null},"mobile":{"status":"pending","path":null,"sha256":null},"keyboardStatus":"pending"},
    {"surfaceId":"page.promotion-planner","pageId":"promotionPlanner","kind":"page","accessMode":"read_only","captureClass":"full_review","triggerSelector":"button[data-nav-label='Promotion Planner']","testId":"pricing.promotion.page","captureId":"page.promotion-planner","desktop":{"status":"pending","path":null,"sha256":null},"mobile":{"status":"pending","path":null,"sha256":null},"keyboardStatus":"pending"},

    {"surfaceId":"tab.forecast.overview","pageId":"demandForecast","kind":"tab","accessMode":"read_only","captureClass":"full_review","triggerSelector":"[role='tab'][aria-label='Overview']","testId":"forecast.tab.overview","captureId":"tab.forecast.overview","desktop":{"status":"pending","path":null,"sha256":null},"mobile":{"status":"pending","path":null,"sha256":null},"keyboardStatus":"pending"},
    {"surfaceId":"tab.forecast.store-view","pageId":"demandForecast","kind":"tab","accessMode":"read_only","captureClass":"full_review","triggerSelector":"[role='tab'][aria-label='Store View']","testId":"forecast.tab.store-view","captureId":"tab.forecast.store-view","desktop":{"status":"pending","path":null,"sha256":null},"mobile":{"status":"pending","path":null,"sha256":null},"keyboardStatus":"pending"},